<?xml version="1.0"?>
<ik
        xmlns="https://github.com/Raphhh/IKSchema"
        xmlns:xsi="http://www.w3.org/2001/XMLSchema-instance"
        xsi:schemaLocation="https://github.com/Raphhh/ik/ik.xsd">
    <meta>
        <version>1.0.3</version>
        <date>2000-12-31</date>
        <reference>https://github.com/Raphhh/ik</reference>
        <language>en-GB</language>
        <title>title value</title>
        <author>author 1</author>
        <author>author 2</author>
        <description>description of the ik</description>
        <image uri="https://github.com/Raphhh/ik/image.png">legend</image>
    </meta>
    <glossary></glossary>
    <taxons></taxons>
</ik>
